[
  { "id": "mnt_forge_tees",      "title": "Re-sod tee boxes — Forge holes 1, 3, 6, 9", "category": "Tees",       "courseId": "crs_academy_loop",    "assignedTo": "stf_grnk_vega", "dueDate": "2026-05-20", "priority": "High",   "status": "Open",        "notes": "Par-3-only wear pattern: tees take a beating. Rotate divot mats Mon/Thu." },
  { "id": "mnt_cru_bunkers",     "title": "Rake & top-up bunkers — Crucible front 5",  "category": "Bunker",     "courseId": "crs_tournament_loop", "assignedTo": "stf_grnk_vega", "dueDate": "2026-05-19", "priority": "Medium", "status": "In Progress", "notes": "Two bunkers below sand line." },
  { "id": "mnt_prv_greens",      "title": "Top-dress Proving greens 4, 6, 8",          "category": "Greens",     "courseId": "crs_tournament_loop", "assignedTo": "stf_grnk_vega", "dueDate": "2026-05-21", "priority": "Medium", "status": "Open",        "notes": "After morning play closes. Coordinate with starter on closures." },
  { "id": "mnt_range_mats",      "title": "Replace range mats — bays 7-12",            "category": "Practice",   "assignedTo": "stf_grnk_vega", "dueDate": "2026-05-22", "priority": "Medium", "status": "Open",        "notes": "Heavy lesson traffic on right-side bays. Inventory: 6 new mats in shed B." },
  { "id": "mnt_putting_green",   "title": "Refresh putting green hole locations",      "category": "Greens",     "assignedTo": "stf_grnk_vega", "dueDate": "2026-05-18", "priority": "Low",    "status": "Completed",   "notes": "Done at 06:00." },
  { "id": "mnt_irrigation_chk",  "title": "Check irrigation heads — Forge holes 4 & 6", "category": "Irrigation","courseId": "crs_academy_loop",    "assignedTo": "stf_grnk_vega", "dueDate": "2026-05-23", "priority": "Low",    "status": "Open",        "notes": "Reports of dry spots near pin placements." },
  { "id": "mnt_short_game_mow",  "title": "Daily short-game area mow",                 "category": "Practice",   "assignedTo": "stf_grnk_vega", "dueDate": "2026-05-19", "priority": "High",   "status": "Open",        "notes": "Recurring 06:00. Highest-use practice area for academy program." },
  { "id": "mnt_clubhouse_signage","title": "Update Academy Loop yardage signage",     "category": "Signage",    "courseId": "crs_academy_loop",    "assignedTo": "stf_shop_okonkwo", "dueDate": "2026-05-25", "priority": "Low",    "status": "Open",        "notes": "New Junior tee yardages from Andrea's plan; print and laminate." }
]
